{
  "$schema": "http://json-schema.org/draft-07/schema#",
  "title": "WebKurierWorkflow",
  "type": "object",
  "required": ["id", "name", "trigger", "steps", "edges"],
  "properties": {
    "id": { "type": "string" },
    "name": { "type": "string" },

    "trigger": {
      "type": "object",
      "required": ["type", "config"],
      "properties": {
        "type": { "type": "string" },
        "config": { "type": "object" }
      }
    },

    "steps": {
      "type": "array",
      "items": {
        "type": "object",
        "required": ["id", "type", "config"],
        "properties": {
          "id": { "type": "string" },
          "type": { "type": "string" },
          "config": { "type": "object" }
        }
      }
    },

    "edges": {
      "type": "array",
      "items": {
        "type": "object",
        "required": ["from", "to"],
        "properties": {
          "from": { "type": "string" },
          "to": { "type": "string" },
          "condition": { "type": "string" }
        }
      }
    },

    "policies": {
      "type": "object",
      "properties": {
        "security_validate_urls": { "type": "boolean", "default": true },
        "security_sanitize_payload": { "type": "boolean", "default": true },
        "chain_audit_enabled": { "type": "boolean", "default": true }
      }
    }
  }
}